query,group,winning_content_type,field_strength,serp_features,simplegrid_present
"real cost of running a factory on spreadsheets",pain,vendor/agency thought-leadership blog,weak-mixed,COULD_NOT_VERIFY,no
"how to calculate true landed cost per SKU",costing,how-to + free template/calculator,mixed-strong,COULD_NOT_VERIFY,no
"best AI-native ERP for mid-market manufacturers",category,listicle/top-AI-ERP roundup,strong,COULD_NOT_VERIFY,no
"NetSuite vs Acumatica for manufacturing",comparison,head-to-head comparison page,strong,COULD_NOT_VERIFY,no
"furniture manufacturing ERP software",vertical,vendor industry page + listicle,strong,COULD_NOT_VERIFY,no
"how to calculate OEE overall equipment effectiveness",costing,definitional how-to (formula),strong,likely-featured-snippet,no
"Dynamics GP end of life what to migrate to",pain/migration,Microsoft-partner migration guide,strong,COULD_NOT_VERIFY,no
"NetSuite alternatives for small manufacturers",comparison,alternatives listicle,strong,COULD_NOT_VERIFY,no
"ERP for small to mid-market manufacturers underserved",pain/category,roundup + thought-leadership,mixed,COULD_NOT_VERIFY,no
"how to calculate burden rate manufacturing labor",costing,definitional how-to (formula),strong,likely-featured-snippet,no
"ERP customization cost manufacturing",costing/category,cost-benchmark guide,mixed-strong,COULD_NOT_VERIFY,no
"how to deploy ERP fast implementation timeline",pain/category,implementation-phases guide,strong,COULD_NOT_VERIFY,no
"job costing calculator manufacturing",costing,interactive free calculator,mixed,COULD_NOT_VERIFY,no
"Odoo vs SAP Business One for small manufacturer",comparison,head-to-head comparison,strong,COULD_NOT_VERIFY,no
